{
  "schemaVersion": "4.0.0",
  "documentVersion": "1.0.41",
  "id": "publish-and-reinstall-agent-factory-plugin",
  "artifactType": "work-unit",
  "projectId": "agent-factory-codex-plugin",
  "lifecycle": {
    "phase": "work-unit",
    "status": "done"
  },
  "createdAt": "2026-07-25T18:57:56+00:00",
  "updatedAt": "2026-07-25T19:20:18+00:00",
  "language": "ko",
  "theme": "default",
  "provenance": {
    "createdBy": "Human",
    "generatedBy": "Agent Factory work-unit manager",
    "sourceRefs": []
  },
  "relations": [],
  "readiness": {
    "reviewedAt": "2026-07-26T03:59:34+09:00",
    "contractValid": true,
    "intakeTraceabilityValid": true,
    "definitionComplete": true,
    "executionContextComplete": true,
    "verificationPlanComplete": true,
    "findings": []
  }
}
