{
  "schemaVersion": "4.0.0",
  "documentVersion": "1.0.11",
  "id": "bump-agent-factory-plugin-cachebuster",
  "artifactType": "work-unit",
  "projectId": "agent-factory-codex-plugin",
  "lifecycle": {
    "phase": "work-unit",
    "status": "ready"
  },
  "createdAt": "2026-07-25T18:33:32+00:00",
  "updatedAt": "2026-07-25T18:35:13+00:00",
  "language": "ko",
  "theme": "default",
  "provenance": {
    "createdBy": "Human",
    "generatedBy": "Agent Factory work-unit manager",
    "sourceRefs": []
  },
  "relations": [],
  "readiness": {
    "reviewedAt": "2026-07-26T03:35:01+09:00",
    "contractValid": true,
    "intakeTraceabilityValid": true,
    "definitionComplete": true,
    "executionContextComplete": true,
    "verificationPlanComplete": true,
    "findings": []
  }
}
