{
  "schemaVersion": "4.0.0",
  "documentVersion": "1.0.25",
  "id": "enforce-script-only-work-unit-execution",
  "artifactType": "work-unit",
  "projectId": "agent-factory",
  "lifecycle": {
    "phase": "work-unit",
    "status": "ready"
  },
  "createdAt": "2026-07-27T16:21:01+00:00",
  "updatedAt": "2026-07-27T16:23:31+00:00",
  "language": "ko",
  "theme": "default",
  "provenance": {
    "createdBy": "Human",
    "generatedBy": "Agent Factory work-unit manager",
    "sourceRefs": []
  },
  "relations": [],
  "readiness": {
    "reviewedAt": "2026-07-28T01:23:27+09:00",
    "contractValid": true,
    "intakeTraceabilityValid": true,
    "definitionComplete": true,
    "executionContextComplete": true,
    "verificationPlanComplete": true,
    "findings": []
  }
}
