{
  "schemaVersion": "4.0.0",
  "documentVersion": "1.0.25",
  "id": "add-human-owner-break-glass",
  "artifactType": "work-unit",
  "projectId": "agent-factory",
  "lifecycle": {
    "phase": "work-unit",
    "status": "working"
  },
  "createdAt": "2026-08-10T15:19:06+00:00",
  "updatedAt": "2026-08-10T15:28:32+00:00",
  "language": "ko",
  "theme": "default",
  "provenance": {
    "createdBy": "Human",
    "generatedBy": "Agent Factory work-unit manager",
    "sourceRefs": []
  },
  "relations": [],
  "readiness": {
    "reviewedAt": "2026-08-11T00:00:00+09:00",
    "contractValid": true,
    "intakeTraceabilityValid": true,
    "definitionComplete": true,
    "executionContextComplete": true,
    "verificationPlanComplete": true,
    "findings": []
  }
}
