{
  "schemaVersion": "4.0.0",
  "documentVersion": "1.0.39",
  "id": "define-intake-agent-delegation-criteria",
  "artifactType": "work-unit",
  "projectId": "agent-factory-codex-plugins",
  "lifecycle": {
    "phase": "work-unit",
    "status": "done"
  },
  "createdAt": "2026-08-06T19:13:14+00:00",
  "updatedAt": "2026-08-06T19:37:46+00:00",
  "language": "ko",
  "theme": "default",
  "provenance": {
    "createdBy": "Human",
    "generatedBy": "Agent Factory work-unit manager",
    "sourceRefs": []
  },
  "relations": [],
  "readiness": {
    "reviewedAt": "2026-08-07T00:00:00+09:00",
    "contractValid": true,
    "intakeTraceabilityValid": true,
    "definitionComplete": true,
    "executionContextComplete": true,
    "verificationPlanComplete": true,
    "findings": []
  }
}
