{
  "schemaVersion": "4.0.0",
  "documentVersion": "1.0.29",
  "id": "canonical-artifact-complete-crud",
  "artifactType": "work-unit",
  "projectId": "agent-factory",
  "lifecycle": {
    "phase": "work-unit",
    "status": "done"
  },
  "createdAt": "2026-07-30T17:44:38+00:00",
  "updatedAt": "2026-07-30T18:45:25+00:00",
  "language": "ko",
  "theme": "default",
  "provenance": {
    "createdBy": "Human",
    "generatedBy": "Agent Factory work-unit manager",
    "sourceRefs": []
  },
  "relations": [],
  "readiness": {
    "reviewedAt": "2026-07-30T17:44:44Z",
    "contractValid": true,
    "intakeTraceabilityValid": true,
    "definitionComplete": true,
    "executionContextComplete": true,
    "verificationPlanComplete": true,
    "findings": []
  }
}
